{
  "task_id": "m-high-portal-launch",
  "version": "0.2.0",
  "help_class": "Must-help",
  "target_level": "High",
  "domain": "product",
  "N": 16,
  "feature_scores": [
    2,
    2,
    2,
    2
  ],
  "difficulty_score": 8,
  "dependency_depth": 3,
  "instance_seed": 2026102826,
  "candidate_pool": [
    "Zhang Wei",
    "Emily Zhou",
    "Emma Lewis",
    "Huang Jie",
    "Li Ming",
    "Priya Sharma",
    "Sarah Johnson",
    "Mike Chen",
    "Jessica Chen",
    "Alex Turner",
    "David Wong",
    "Wang Fang",
    "Chen Xinyi",
    "Sophia Rodriguez",
    "Liu Qiang",
    "Jessica Lee"
  ],
  "workflow_id": "portal-launch",
  "workflow_pair_id": null,
  "source_spec": {
    "commit": "local",
    "path": "12_Study2_Task_Redesign_20261026-1923.md",
    "section": "13"
  },
  "output_contract": {
    "path": "/workspace/deliverable.json",
    "format": "JSON",
    "fields": {
      "docs_build_id": "str",
      "qa_signoff": "str",
      "launch_date": "str",
      "authorization_ref": "str"
    },
    "equivalences": [
      "Numeric values may be represented with equivalent decimal precision.",
      "JSON object key order is immaterial.",
      "UTC times use HH:MM.",
      "IDs are stable identifiers, not arbitrary paraphrases.",
      "List fields are order-insensitive multisets."
    ],
    "grading_implemented": false
  },
  "runtime_classification_status": "design_proposed_pending_task_evaluator",
  "feature_names": [
    "candidate_pool",
    "dependency_depth",
    "knowledge_authority_separation",
    "inference_type"
  ],
  "separation": "separated-delegation",
  "structure": "chain3",
  "cue": null,
  "quality": null,
  "inference_evidence": [
    "Product map → search PM; out-of-office → delegate."
  ],
  "candidate_pool_semantics": "relevant directory + configured task NPCs; other TAC accounts remain visible",
  "profile_conditions": [
    "R0",
    "R1"
  ],
  "default_profile": "R1",
  "hidden_information_ids": [
    "H1",
    "H2",
    "H3",
    "D1",
    "D2"
  ],
  "gold_dag": {
    "nodes": [
      {
        "id": "h1",
        "admissible_recipients": [
          "Priya Sharma"
        ],
        "information_ids": [
          "H1"
        ],
        "requires": []
      },
      {
        "id": "h2",
        "admissible_recipients": [
          "Liu Qiang"
        ],
        "information_ids": [
          "H2"
        ],
        "requires": [
          "h1"
        ]
      },
      {
        "id": "h3",
        "admissible_recipients": [
          "Jessica Chen"
        ],
        "information_ids": [
          "H3"
        ],
        "requires": [
          "h2"
        ]
      }
    ],
    "edges": [
      [
        "h1",
        "h2"
      ],
      [
        "h2",
        "h3"
      ]
    ]
  },
  "services": [
    "owncloud",
    "rocketchat"
  ],
  "npc_backend": "official TAC Sotopia LLM NPC; not live-tested",
  "runtime": {
    "platform": "linux/amd64",
    "tac_commit": "98b68ef82a47690c316f42fddb05baafaab56851",
    "execution_target": "OpenHands CodeActAgent via TAC; integration not yet executed",
    "model": null,
    "model_calls": 0
  },
  "verification": {
    "independent_task_evaluator": "pending",
    "human_review": "pending",
    "live_npc_compliance": "not_tested",
    "openhands_rollout": "not_run"
  },
  "known_limitations": [
    "Structural labels are design claims.",
    "LLM NPC prerequisite compliance needs live validation.",
    "Single fixed instance.",
    "Shared service reset/isolation required before episodes."
  ]
}
