{
  "task_id": "o-med-brochure-translation",
  "version": "0.2.0",
  "help_class": "Optional-help",
  "target_level": "Medium",
  "domain": "marketing",
  "N": 4,
  "feature_scores": [
    0,
    2,
    0,
    1
  ],
  "difficulty_score": 3,
  "dependency_depth": 1,
  "instance_seed": 2026102839,
  "candidate_pool": [
    "Sophia Rodriguez",
    "Jessica Chen",
    "Jessica Lee",
    "Huang Jie"
  ],
  "workflow_id": "brochure-translation",
  "workflow_pair_id": null,
  "source_spec": {
    "commit": "local",
    "path": "12_Study2_Task_Redesign_20261026-1923.md",
    "section": "13"
  },
  "output_contract": {
    "path": "/workspace/deliverable.json",
    "format": "JSON",
    "fields": {
      "vendor": "str",
      "words": "int",
      "total_usd": "int"
    },
    "equivalences": [
      "Numeric values may be represented with equivalent decimal precision.",
      "JSON object key order is immaterial.",
      "UTC times use HH:MM.",
      "IDs are stable identifiers, not arbitrary paraphrases.",
      "List fields are order-insensitive multisets."
    ],
    "grading_implemented": false
  },
  "runtime_classification_status": "design_proposed_pending_task_evaluator",
  "feature_names": [
    "candidate_pool",
    "cue_salience",
    "holder_inference",
    "integration_effort"
  ],
  "separation": "not_applicable",
  "structure": "optional_information",
  "cue": {
    "documents": [
      "vendors.md",
      "marketing-log.md"
    ],
    "description": "Combine list-rate quote with the framework renewal note."
  },
  "quality": {
    "dimension": "total_usd",
    "baseline": 1440,
    "full_information": 960,
    "minimum_improvement": 300,
    "constraints": []
  },
  "inference_evidence": [
    "Marketing Manager named."
  ],
  "candidate_pool_semantics": "relevant directory + configured task NPCs; other TAC accounts remain visible",
  "profile_conditions": [
    "R0",
    "R1"
  ],
  "default_profile": "R1",
  "hidden_information_ids": [
    "H1"
  ],
  "gold_dag": {
    "nodes": [
      {
        "id": "h1",
        "admissible_recipients": [
          "Jessica Lee"
        ],
        "information_ids": [
          "H1"
        ],
        "requires": []
      }
    ],
    "edges": []
  },
  "services": [
    "owncloud",
    "rocketchat"
  ],
  "npc_backend": "official TAC Sotopia LLM NPC; not live-tested",
  "runtime": {
    "platform": "linux/amd64",
    "tac_commit": "98b68ef82a47690c316f42fddb05baafaab56851",
    "execution_target": "OpenHands CodeActAgent via TAC; integration not yet executed",
    "model": null,
    "model_calls": 0
  },
  "verification": {
    "independent_task_evaluator": "pending",
    "human_review": "pending",
    "live_npc_compliance": "not_tested",
    "openhands_rollout": "not_run"
  },
  "known_limitations": [
    "Structural labels are design claims.",
    "LLM NPC prerequisite compliance needs live validation.",
    "Single fixed instance.",
    "Shared service reset/isolation required before episodes."
  ]
}
