{
  "task_id": "m-high-model-release",
  "version": "0.2.0",
  "help_class": "Must-help",
  "target_level": "High",
  "domain": "ai-research",
  "N": 16,
  "feature_scores": [
    2,
    2,
    2,
    2
  ],
  "difficulty_score": 8,
  "dependency_depth": 3,
  "instance_seed": 2026102818,
  "candidate_pool": [
    "Emily Zhou",
    "Wang Fang",
    "Emma Lewis",
    "Alex Turner",
    "Mark Johnson",
    "Liu Qiang",
    "Sarah Johnson",
    "Sophia Rodriguez",
    "Chen Xinyi",
    "Priya Sharma",
    "Jessica Chen",
    "David Wong",
    "Huang Jie",
    "Zhang Wei",
    "Mike Chen",
    "Li Ming"
  ],
  "workflow_id": "model-release",
  "workflow_pair_id": null,
  "source_spec": {
    "commit": "local",
    "path": "12_Study2_Task_Redesign_20261026-1923.md",
    "section": "13"
  },
  "output_contract": {
    "path": "/workspace/deliverable.json",
    "format": "JSON",
    "fields": {
      "checkpoint": "str",
      "eval_report_id": "str",
      "safety_attestation": "str",
      "release_tier": "str",
      "mandate_reference": "str"
    },
    "equivalences": [
      "Numeric values may be represented with equivalent decimal precision.",
      "JSON object key order is immaterial.",
      "UTC times use HH:MM.",
      "IDs are stable identifiers, not arbitrary paraphrases.",
      "List fields are order-insensitive multisets."
    ],
    "grading_implemented": false
  },
  "runtime_classification_status": "design_proposed_pending_task_evaluator",
  "feature_names": [
    "candidate_pool",
    "dependency_depth",
    "knowledge_authority_separation",
    "inference_type"
  ],
  "separation": "separated-conditional",
  "structure": "chain3",
  "cue": null,
  "quality": null,
  "inference_evidence": [
    "Tier rule applied to the current report changes the mandate holder.",
    "Research owner and QA found via directory."
  ],
  "candidate_pool_semantics": "relevant directory + configured task NPCs; other TAC accounts remain visible",
  "profile_conditions": [
    "R0",
    "R1"
  ],
  "default_profile": "R1",
  "hidden_information_ids": [
    "H1",
    "H2",
    "H3"
  ],
  "gold_dag": {
    "nodes": [
      {
        "id": "h1",
        "admissible_recipients": [
          "Wang Fang"
        ],
        "information_ids": [
          "H1"
        ],
        "requires": []
      },
      {
        "id": "h2",
        "admissible_recipients": [
          "Liu Qiang"
        ],
        "information_ids": [
          "H2"
        ],
        "requires": [
          "h1"
        ]
      },
      {
        "id": "h3",
        "admissible_recipients": [
          "Sarah Johnson"
        ],
        "information_ids": [
          "H3"
        ],
        "requires": [
          "h2"
        ]
      }
    ],
    "edges": [
      [
        "h1",
        "h2"
      ],
      [
        "h2",
        "h3"
      ]
    ]
  },
  "services": [
    "owncloud",
    "rocketchat"
  ],
  "npc_backend": "official TAC Sotopia LLM NPC; not live-tested",
  "runtime": {
    "platform": "linux/amd64",
    "tac_commit": "98b68ef82a47690c316f42fddb05baafaab56851",
    "execution_target": "OpenHands CodeActAgent via TAC; integration not yet executed",
    "model": null,
    "model_calls": 0
  },
  "verification": {
    "independent_task_evaluator": "pending",
    "human_review": "pending",
    "live_npc_compliance": "not_tested",
    "openhands_rollout": "not_run"
  },
  "known_limitations": [
    "Structural labels are design claims.",
    "LLM NPC prerequisite compliance needs live validation.",
    "Single fixed instance.",
    "Shared service reset/isolation required before episodes."
  ]
}
